{
  "$schema": "https://json-schema.org/draft/2020-12/schema",
  "$id": "https://qtm3.dev/schemas/material-reference-suite/v1",
  "title": "QtMaterial3 Material reference suite",
  "description": "Deterministic component/state/theme case matrix and source-backed conformance assertions.",
  "x-qtm3-schemaVersion": 1,
  "type": "object",
  "additionalProperties": false,
  "required": [
    "schemaVersion",
    "id",
    "profileId",
    "componentModelId",
    "status",
    "coverage",
    "family",
    "anchorComponentId",
    "sourceRefs",
    "caseDimensions",
    "cases"
  ],
  "properties": {
    "schemaVersion": {
      "const": 1
    },
    "id": {
      "type": "string",
      "pattern": "^[a-z0-9]+(?:[.-][a-z0-9]+)*$"
    },
    "profileId": {
      "type": "string",
      "minLength": 1
    },
    "componentModelId": {
      "type": "string",
      "minLength": 1
    },
    "status": {
      "enum": [
        "seeded",
        "evidence-backed"
      ]
    },
    "coverage": {
      "$ref": "#/$defs/coverage"
    },
    "fixture": {
      "$ref": "#/$defs/fixture"
    },
    "family": {
      "type": "string",
      "minLength": 1
    },
    "anchorComponentId": {
      "type": "string",
      "minLength": 1
    },
    "sourceRefs": {
      "type": "array",
      "minItems": 1,
      "uniqueItems": true,
      "items": {
        "type": "string",
        "minLength": 1
      }
    },
    "caseDimensions": {
      "$ref": "#/$defs/caseDimensions"
    },
    "cases": {
      "type": "array",
      "minItems": 1,
      "items": {
        "$ref": "#/$defs/case"
      }
    }
  },
  "allOf": [
    {
      "if": {
        "properties": {
          "status": {
            "const": "evidence-backed"
          }
        }
      },
      "then": {
        "required": [
          "fixture"
        ]
      }
    }
  ],
  "$defs": {
    "coverage": {
      "type": "object",
      "additionalProperties": false,
      "required": [
        "mode"
      ],
      "properties": {
        "mode": {
          "enum": [
            "full-model",
            "vertical-slice"
          ]
        },
        "rationale": {
          "type": "string",
          "minLength": 1
        }
      },
      "allOf": [
        {
          "if": {
            "properties": {
              "mode": {
                "const": "vertical-slice"
              }
            }
          },
          "then": {
            "required": [
              "rationale"
            ]
          }
        }
      ]
    },
    "fixture": {
      "type": "object",
      "additionalProperties": false,
      "required": [
        "size",
        "density",
        "content"
      ],
      "properties": {
        "size": {
          "enum": [
            "small"
          ]
        },
        "density": {
          "enum": [
            "default",
            "compact",
            "comfortable"
          ]
        },
        "content": {
          "enum": [
            "label-only",
            "label-and-leading-icon"
          ]
        }
      }
    },
    "caseDimensions": {
      "type": "object",
      "additionalProperties": false,
      "required": [
        "components",
        "states",
        "themes"
      ],
      "properties": {
        "components": {
          "type": "array",
          "minItems": 1,
          "uniqueItems": true,
          "items": {
            "type": "string",
            "minLength": 1
          }
        },
        "states": {
          "type": "array",
          "minItems": 1,
          "uniqueItems": true,
          "items": {
            "enum": [
              "enabled",
              "disabled",
              "hovered",
              "focused",
              "pressed",
              "dragged",
              "selected",
              "unselected"
            ]
          }
        },
        "themes": {
          "type": "array",
          "minItems": 1,
          "uniqueItems": true,
          "items": {
            "enum": [
              "light",
              "dark"
            ]
          }
        }
      }
    },
    "case": {
      "type": "object",
      "additionalProperties": false,
      "required": [
        "id",
        "componentId",
        "state",
        "theme",
        "classification",
        "assertions"
      ],
      "properties": {
        "id": {
          "type": "string",
          "minLength": 1
        },
        "componentId": {
          "type": "string",
          "minLength": 1
        },
        "state": {
          "type": "string",
          "minLength": 1
        },
        "theme": {
          "enum": [
            "light",
            "dark"
          ]
        },
        "classification": {
          "$ref": "#/$defs/classification"
        },
        "assertions": {
          "type": "array",
          "items": {
            "$ref": "#/$defs/assertion"
          }
        }
      }
    },
    "classification": {
      "enum": [
        "MUST_MATCH",
        "PLATFORM_ADAPTATION",
        "QTMATERIAL_EXTENSION"
      ]
    },
    "assertion": {
      "type": "object",
      "additionalProperties": false,
      "required": [
        "id",
        "domain",
        "classification",
        "path",
        "operator",
        "expected",
        "sourceRefs"
      ],
      "properties": {
        "id": {
          "type": "string",
          "minLength": 1
        },
        "domain": {
          "enum": [
            "geometry",
            "tokens",
            "colors",
            "typography",
            "states",
            "motion",
            "accessibility",
            "behavior"
          ]
        },
        "classification": {
          "$ref": "#/$defs/classification"
        },
        "path": {
          "type": "string",
          "minLength": 1
        },
        "operator": {
          "enum": [
            "equals",
            "approx",
            "token-equals",
            "range",
            "present",
            "absent"
          ]
        },
        "expected": {},
        "tolerance": {},
        "sourceRefs": {
          "type": "array",
          "minItems": 1,
          "uniqueItems": true,
          "items": {
            "type": "string",
            "minLength": 1
          }
        },
        "evidence": {
          "type": "array",
          "minItems": 1,
          "uniqueItems": true,
          "items": {
            "$ref": "#/$defs/evidence"
          }
        },
        "notes": {
          "type": "string",
          "minLength": 1
        }
      }
    },
    "evidence": {
      "type": "object",
      "additionalProperties": false,
      "required": [
        "sourceRef",
        "locator"
      ],
      "properties": {
        "sourceRef": {
          "type": "string",
          "minLength": 1
        },
        "locator": {
          "type": "string",
          "pattern": "^.+#L[1-9][0-9]*(?:-L[1-9][0-9]*)?$"
        },
        "symbol": {
          "type": "string",
          "minLength": 1
        }
      }
    }
  }
}
